{
  "schemaVersion": "1.0",
  "devKitVersion": "1.0.0",
  "mode": "authoritative",
  "compatibilityPolicy": {
    "readOnly": false,
    "authoritative": true,
    "changesRuntimeBehavior": true,
    "phase": "1.0.0"
  },
  "groups": {
    "sourceRequired": [
      ".github/CODEOWNERS",
      ".github/pull_request_template.md",
      ".github/workflows/dev-kit-pr-checks.yml",
      ".github/workflows/dev-kit-release-checks.yml",
      "CONTRIBUTING.md",
      "LICENSE.md",
      "README.md",
      "README.zh-CN.md",
      "SECURITY.md",
      "VERSION.md",
      "checklists/automation-review.md",
      "checklists/core-purity-review.md",
      "checklists/daily-summary-review.md",
      "checklists/engineering-baseline-review.md",
      "checklists/goal-mode-review.md",
      "checklists/industrial-pack-review.md",
      "checklists/next-step-boundary-review.md",
      "checklists/profile-review.md",
      "checklists/project-onboarding-review.md",
      "checklists/release-gate.md",
      "checklists/review-loop-review.md",
      "checklists/risk-gate.md",
      "checklists/scope-gate.md",
      "checklists/self-iteration-review.md",
      "checklists/skill-review.md",
      "checklists/starter-review.md",
      "checklists/subagent-orchestration-review.md",
      "checklists/verification-gate.md",
      "core/automation-governance.md",
      "core/engineering-baseline.md",
      "core/extension-policy.md",
      "core/gates.md",
      "core/glossary.md",
      "core/goal-mode.md",
      "core/next-step-boundary.md",
      "core/output-protocol.md",
      "core/platform-strategy.md",
      "core/project-onboarding.md",
      "core/review-loop.md",
      "core/self-iteration.md",
      "core/skill-governance.md",
      "core/subagent-orchestration.md",
      "core/task-levels.md",
      "core/workflow.md",
      "decision-briefs/035-readonly-manifest.md",
      "decision-briefs/036-cli-front-door.md",
      "decision-briefs/037-manifest-authoritative.md",
      "decision-briefs/038-init-update-safety.md",
      "decision-briefs/039-artifact-frontmatter-schema.md",
      "decision-briefs/040-checker-library-refactor.md",
      "decision-briefs/040-fixture-matrix-expansion.md",
      "dev-kit-manifest.json",
      "docs/adoption-playbooks/existing-light-project.md",
      "docs/adoption-playbooks/governed-project-read-only.md",
      "docs/adoption-playbooks/new-project.md",
      "docs/adoption-playbooks/production-project-adapter.md",
      "docs/artifact-decision-tree.md",
      "docs/codex-usage.md",
      "docs/faq.md",
      "docs/goal-subagent-usage.md",
      "docs/governance-hardening-roadmap.md",
      "docs/mental-model.md",
      "docs/migrations/0.33-to-1.0.md",
      "docs/migrations/index.md",
      "docs/operator-manual.md",
      "docs/productization-hardcut-1.0-plan.md",
      "docs/quickstart.md",
      "docs/reference/artifacts.md",
      "docs/reference/checkers.md",
      "docs/reference/industrial-packs.md",
      "docs/reference/scripts.md",
      "docs/troubleshooting.md",
      "evals/034-baseline-freeze-self-ci.md",
      "evals/035-readonly-manifest.md",
      "evals/036-cli-front-door.md",
      "evals/037-manifest-authoritative.md",
      "evals/038-init-update-safety.md",
      "evals/039-artifact-frontmatter-schema.md",
      "evals/040-checker-library-refactor.md",
      "evals/040-fixture-matrix-expansion.md",
      "examples/engineering-baseline-api-dto-domain/README.md",
      "examples/engineering-baseline-api-dto-domain/decision-briefs/001-dto-domain-boundary.md",
      "examples/engineering-baseline-api-dto-domain/docs/engineering-baseline.md",
      "examples/engineering-baseline-enum-vs-lookup/README.md",
      "examples/engineering-baseline-enum-vs-lookup/decision-briefs/001-status-model-decision.md",
      "examples/engineering-baseline-enum-vs-lookup/docs/engineering-baseline.md",
      "examples/generic-first-change/README.md",
      "examples/goal-mode-first-route/README.md",
      "examples/goal-mode-first-route/goal-cards/001-define-work.md",
      "examples/goal-subagent-l2-feature/README.md",
      "examples/goal-subagent-l2-feature/docs/engineering-baseline.md",
      "examples/goal-subagent-l2-feature/evals/001-project-status-filter.md",
      "examples/goal-subagent-l2-feature/final-reports/001-project-status-filter.md",
      "examples/goal-subagent-l2-feature/follow-up-proposals/001-status-filter-lookup-admin.md",
      "examples/goal-subagent-l2-feature/goal-cards/001-project-status-filter.md",
      "examples/goal-subagent-l2-feature/gpt-review-prompts/001-project-status-filter.md",
      "examples/goal-subagent-l2-feature/preflight/001-project-status-filter.md",
      "examples/goal-subagent-l2-feature/requests/001-project-status-filter.md",
      "examples/goal-subagent-l2-feature/review-loop-reports/001-project-status-filter.md",
      "examples/goal-subagent-l2-feature/review-packets/001-project-status-filter.md",
      "examples/goal-subagent-l2-feature/review-summaries/001-project-status-filter.md",
      "examples/goal-subagent-l2-feature/specs/001-project-status-filter.md",
      "examples/goal-subagent-l2-feature/subagent-run-plans/001-project-status-filter.md",
      "examples/goal-subagent-l2-feature/tasks/001-project-status-filter.md",
      "examples/miniprogram-industrial-bl2-first-slice/README.md",
      "examples/miniprogram-industrial-bl2-first-slice/ai-logs/2026-06-26-miniprogram-login-cloud-read.md",
      "examples/miniprogram-industrial-bl2-first-slice/docs/baseline-evidence.md",
      "examples/miniprogram-industrial-bl2-first-slice/docs/baseline-selection.md",
      "examples/miniprogram-industrial-bl2-first-slice/evals/001-miniprogram-login-cloud-read.md",
      "examples/miniprogram-industrial-bl2-first-slice/evidence/miniprogram-runtime-evidence.md",
      "examples/miniprogram-industrial-bl2-first-slice/preflight/001-miniprogram-login-cloud-read.md",
      "examples/miniprogram-industrial-bl2-first-slice/releases/001-miniprogram-login-cloud-read-release.md",
      "examples/miniprogram-industrial-bl2-first-slice/requests/001-miniprogram-login-cloud-read.md",
      "examples/miniprogram-industrial-bl2-first-slice/specs/001-miniprogram-login-cloud-read.md",
      "examples/miniprogram-industrial-bl2-first-slice/tasks/001-miniprogram-login-cloud-read.md",
      "examples/next-step-boundary-suggestions/README.md",
      "examples/next-step-boundary-suggestions/final-reports/001-suggestions.md",
      "examples/review-loop-l2-first-slice/README.md",
      "examples/review-loop-l2-first-slice/evals/001-review-loop-l2-slice.md",
      "examples/review-loop-l2-first-slice/final-reports/001-review-loop-l2-slice.md",
      "examples/review-loop-l2-first-slice/follow-up-proposals/001-review-loop-l2-slice.md",
      "examples/review-loop-l2-first-slice/gpt-review-prompts/001-review-loop-l2-slice.md",
      "examples/review-loop-l2-first-slice/preflight/001-review-loop-l2-slice.md",
      "examples/review-loop-l2-first-slice/requests/001-review-loop-l2-slice.md",
      "examples/review-loop-l2-first-slice/review-loop-reports/001-review-loop-l2-slice.md",
      "examples/review-loop-l2-first-slice/review-packets/001-review-loop-l2-slice.md",
      "examples/review-loop-l2-first-slice/review-summaries/001-review-loop-l2-slice.md",
      "examples/review-loop-l2-first-slice/specs/001-review-loop-l2-slice.md",
      "examples/review-loop-l2-first-slice/tasks/001-review-loop-l2-slice.md",
      "examples/subagent-orchestration-closed-run/README.md",
      "examples/subagent-orchestration-closed-run/subagent-run-plans/001-closed-review.md",
      "examples/web-industrial-bl2-first-slice/README.md",
      "examples/web-industrial-bl2-first-slice/ai-logs/2026-06-26-web-runtime-quality.md",
      "examples/web-industrial-bl2-first-slice/docs/baseline-evidence.md",
      "examples/web-industrial-bl2-first-slice/docs/baseline-selection.md",
      "examples/web-industrial-bl2-first-slice/evals/001-web-runtime-quality.md",
      "examples/web-industrial-bl2-first-slice/evidence/web-runtime-evidence.md",
      "examples/web-industrial-bl2-first-slice/preflight/001-web-runtime-quality.md",
      "examples/web-industrial-bl2-first-slice/releases/001-web-runtime-quality-release.md",
      "examples/web-industrial-bl2-first-slice/requests/001-web-runtime-quality.md",
      "examples/web-industrial-bl2-first-slice/specs/001-web-runtime-quality.md",
      "examples/web-industrial-bl2-first-slice/tasks/001-web-runtime-quality.md",
      "examples/web-internal-admin-first-slice/README.md",
      "examples/web-internal-admin-first-slice/ai-task-log.example.md",
      "examples/web-internal-admin-first-slice/eval.md",
      "examples/web-internal-admin-first-slice/preflight-report.md",
      "examples/web-internal-admin-first-slice/request-card.md",
      "examples/web-internal-admin-first-slice/spec.md",
      "examples/web-internal-admin-first-slice/task-card.md",
      "final-reports/034-baseline-freeze-self-ci.md",
      "final-reports/035-readonly-manifest.md",
      "final-reports/036-cli-front-door.md",
      "final-reports/037-manifest-authoritative.md",
      "final-reports/038-init-update-safety.md",
      "final-reports/039-artifact-frontmatter-schema.md",
      "final-reports/040-checker-library-refactor.md",
      "final-reports/040-fixture-matrix-expansion.md",
      "goal-cards/034-baseline-freeze-self-ci.md",
      "goal-cards/035-readonly-manifest.md",
      "goal-cards/036-cli-front-door.md",
      "goal-cards/037-manifest-authoritative.md",
      "goal-cards/038-init-update-safety.md",
      "goal-cards/039-artifact-frontmatter-schema.md",
      "goal-cards/040-checker-library-refactor.md",
      "goal-cards/040-fixture-matrix-expansion.md",
      "industrial-pack-candidates/README.md",
      "industrial-pack-candidates/web-app/README.md",
      "industrial-packs/README.md",
      "industrial-packs/index.json",